Question,A,B,C,D,Answer,Grade
"Cho đoạn văn: “(1) Hằng năm cứ vào cuối thu lá ngoài đường rụng nhiều và trên không có những đám mây bàng bạc, lòng tôi lại náo nức những kỉ niệm mơn man của buổi tựu trường. (2) Tôi quên thế nào được những cảm giác trong sáng ấy nảy nở trong lòng tôi như những cánh hoa tươi mỉm cười giữa bầu trời quang đãng.” Chỉ ra các câu văn chứa yếu tố miêu tả trong đoạn văn trên?",Câu (1),Câu (2),Cả 2 câu,Đoạn văn không có chứa yếu tố miêu tả và biểu cảm,C,Ngữ văn 8
Tác dụng của các yếu tố miêu tả và biểu cảm trong đoạn văn trên là gì?,Giúp cho việc kể chuyện sinh động và sâu sắc hơn,"Diễn tả một cách chi tiết, cụ thể và đậm nét những điều đã gợi lên trong lòng nhân vật ""tôi"" kỉ niệm về buổi tựu trường đầu tiên: thời tiết cuối thu, lá rụng ngoài đường nhiều, trên không có những đám mây bàng bạc",Tô đậm tâm trạng khi nhớ lại về kỉ niệm ngày đầu tiên đi học mà tác giả không thể nào quên được,"Cả A, B, C đều đúng",D,Ngữ văn 8
"Ý nào nhận định đúng nhất về câu sau? Giá những cổ tục đã đày đoạ mẹ tôi là một vật như hòn đá hay cục thuỷ tinh, đầu mẩu gỗ, tôi quyết vồ lấy mà cắn, mà nhai, mà nghiến cho kì nát vụn mới thôi. (Trong lòng mẹ)",Là một câu ghép có quan hệ từ chỉ mục đích.,Là một câu ghép có quan hệ từ chỉ nguyên nhân.,Là một câu ghép có quan hệ từ chỉ quan hệ điều kiện.,Là một câu ghép có quan hệ từ chỉ quan hệ nhượng bộ,A,Ngữ văn 8
Dòng nào dưới đây nói đúng nhất về câu ghép?,Là câu chỉ có một cụm chủ - vị làm nòng cốt,Là câu có 2 cụm chủ vị và chúng không bao chứa nhau,Là câu có hai cụm chủ - vị trở lên và chúng không bao chứa nhau,Là câu có 3 cụm chủ vị và chúng bao chứa nhau,C,Ngữ văn 8
Hai câu đơn: “Mẹ đi làm. Em đi học” được biến đổi thành một câu ghép. Câu ghép nào dưới đây không hợp lý về mặt ý nghĩa?,Mẹ đi làm và em đi học.,Mẹ đi làm còn em đi học.,Mẹ đi làm nhưng em đi học.,"Mẹ đi làm, em đi học.",B,Ngữ văn 8
Thế nào là hai cụm chủ vị bao chứa nhau?,Hai cụm chủ vị đó phải tạo nên một câu ghép.,Hai cụm chủ vị mà cụm chủ vị này nằm trong cụm chủ vị kia và cụm chủ vị kia bao hàm cụm chủ vị này.,Hai cụm chủ vị quan hệ song song và bình đẳng với nhau trong câu.,"Hai cụm chủ vị độc lập với nhau, không có quan hệ về mặt ngữ pháp.",B,Ngữ văn 8
"Khi xem xét và phân loại câu ghép, người ta chủ yếu dựa vào quan hệ về mặt nào giữa các vế câu?",Quan hệ về mặt ngữ pháp giữa các vế câu.,Quan hệ về mặt ngữ nghĩa giữa các vế câu.,Quan hệ về mặt từ loại giữa các vế câu.,Quan hệ về mặt ngữ âm giữa các vế câu.,B,Ngữ văn 8
"Trong các câu sau, câu nào không phải là câu ghép?",Hôm nay tôi đi học còn Nam đi chơi thể thao.,Hôm nay tôi đi học và Nam đi chơi thể thao.,"Hôm nay tôi đi học, Nam đi chơi thể thao.",Hôm nay tôi đi học và đi chơi thể thao.,D,Ngữ văn 8
Câu nào trong các câu ghép sau chỉ quan hệ nhượng bộ?,"Vì tên Dậu là thân nhân của hắn, nên chúng con bắt hắn phải nộp thay. (Ngô Tất Tố)",Giá hắn biết hát thì có lẽ hắn không cần chửi. (Nam Cao),"Gió càng to, lửa càng cao.","Việc này tuy là thể dục, nhưng các thầy không được coi thường. (Nguyễn Công Hoan)",A,Ngữ văn 8
"Quan hệ từ được in đậm trong câu ghép sau chỉ quan hệ nào? Nếu là chim, tôi sẽ là loài bồ câu trắng Nếu là hoa, tôi sẽ là một đoá hướng dương. Nếu là mây, tôi sẽ là một vầng mây ấm Là người, tôi sẽ chết cho quê hương.",Quan hệ nhượng bộ,Quan hệ mục đích,Quan hệ nguyên nhân,Quan hệ điều kiện,D,Ngữ văn 8
"Trong các câu sau, câu nào không phải là câu ghép?","Tôi chạy, nó cũng chạy.","Dần hãy để cho chị đi với u, đừng giữ chị nữa.","Lòng tôi càng thắt lại, khoé mắt tôi cay cay.","Chị con có đi, u mới có tiền nộp sưu.",C,Ngữ văn 8
"Trong các câu sau, câu nào là câu ghép?","Người lớn hút thuốc trước mặt trẻ em, lấy điếu thuốc làm một cử chỉ cho biểu tượng quý trọng chính là đẩy con em vào con đường phạm pháp.","Quân Triều đình đã đốt rừng để giết chết người thủ lĩnh nghĩa quân đó, cuộc khởi nghĩa bị dập tắt.",Cây dừa gắn bó với người dân Bình Định chặt chẽ như cây tre đối với người dân miền Bắc.,"Những vườn hoa, cây cảnh, những vườn chè, vườn cây ăn quả của Huế xanh mướt như những viên ngọc.",A,Ngữ văn 8
"Tìm cụm C - V chính và C - V phụ trong câu sau. ""Tôi quên thế nào được những cảm giác trong sáng ấy nảy nở trong lòng tôi như mấy cành hoa tươi mỉm cười giữa bầu trời quang đãng.""","CN Chính: tôi, VN Chính: quên thế nào được những cảm giác trong sáng ấy nảy nở trong lòng tôi","CN Chính: tôi, VN Chính: quên thế nào được những cảm giác trong sáng ấy nảy nở trong lòng tôi như mấy cành hoa tươi mỉm cười giữa bầu trời quang đãng.",CN phụ : mấy cánh hoa tươi,VN phụ: mỉm cười giữa bầu trời quang đãng.,B,Ngữ văn 8
Câu nào là câu ghép?,U van Dần!,"Chị con có đi, u mới có tiền nộp sưu, thầy Dần mới được về với Dần chứ!","Sáng nay người ta đánh trói thầy Dần như thế, Dần có thương không?","Nếu Dần không buông chị ra, chốc nữa ông lý vào đây, ông ấy trói nốt cả u, trói nốt cả Dần đấy.",B,Ngữ văn 8
"Có mấy câu ghép trong các đoạn văn sau: “Cai lệ tát vào mặt chị một cái bốp, rồi hắn cứ nhảy vào cạnh anh Dậu, Chị Dậu nghiến hai hàm răng: - Mày trói ngay chồng bà đi, bà cho mày xem! Rồi chị túm lấy cổ hắn, ấn dúi ra cửa. Sức lẻo khoẻo của anh chàng nghiện chạy không kịp với sức xô đẩy của người đàn bà lực điền, hắn ngã chỏng quèo trên mặt đất, miệng vẫn nham nhảm thét trói vợ chồng kẻ thiếu sưu…”",1,2,3,4,B,Ngữ văn 8
Câu nào dưới đây định nghĩa đúng nhất về câu ghép?,Là câu do một hoặc hai cụm chủ vị tạo thành.,Là câu có hai cụm chủ vị trở lên tạo thành.,Là câu có hai cụm chủ vị trở lên bao chứa nhau tạo thành.,Là câu có hai cụm chủ vị trở lên không bao chứa nhau tạo thành.,A,Ngữ văn 8
"Để xem xét một câu có phải là câu ghép hay không, chúng ta phải xem xét khía cạnh nào?",Xét quan hệ về mặt ngữ âm giữa các vế câu.,Xét quan hệ về mặt ngữ nghĩa giữa các vế câu.,Xét quan hệ về mặt ngữ pháp giữa các vế câu.,Xét quan hệ về mặt bổ trợ nhau giữa các vế câu.,B,Ngữ văn 8
"Trong câu ghép, từ “nếu” là từ chỉ loại quan hệ nào?",Quan hệ nguyên nhân - kết quả.,Quan hệ bổ sung.,Quan hệ khả năng - điều kiện.,Quan hệ nội dung - hình thức.,C,Ngữ văn 8
"Pháp chạy, Nhật hàng, vua Bảo Đại thoái vị đã sử dụng phương pháp nào để nối các câu ghép?",Dùng các dấu câu.,Dùng các dấu câu và từ có quan hệ điều kiện.,Dùng từ có quan hệ nguyên nhân.,Dùng từ có quan hệ bổ sung.,A,Ngữ văn 8
Quan hệ từ nào sau đây không phải là loại quan hệ từ dùng để nối các vế câu ghép với nhau?,Quan hệ từ chỉ nguyên nhân.,Quan hệ từ chỉ điều kiện.,Quan hệ từ chi nhượng bộ.,Quan hệ từ chỉ cách thức.,A,Ngữ văn 8
Hai câu đơn: “Bố em đi làm. Mẹ em đi sang bà ngoại” được biến đổi thành một câu ghép. Câu ghép nào dưới đây không hợp lý về mặt ý nghĩa?,Bố em đi làm và mẹ em đi sang bà ngoại.,Bố em đi làm còn mẹ em đi sang bà ngoại.,Bố em đi làm nhưng mẹ em đi sang bà ngoại.,"Bố em đi làm, mẹ em đi sang bà ngoại.",B,Ngữ văn 8
"Xác định các vế của câu ghép đó trong đoạn văn sau: Thần Nắng cũng đem ấm áp đến vùng ngập lũ. Nước rút nhanh, hoa cỏ bừng nở, chim gọi bầy làm tổ, ong tìm hoa làm mật. Vạn vật trút bỏ lớp áo ướt át, vui đón những tia nắng ấm chan hòa. Không ai nói với ai điều gì nhưng thần Mưa và thần Nắng đều hiểu rằng, mùa xuân chỉ trở về trong thuận hòa và yêu thương.",1 vế,2 vế,3 vế,4 vế,C,Ngữ văn 8
Em hãy chỉ ra các câu ghép có trong đoạn văn trên.,Cho đoạn văn sau:,"(1), (2)",Ngọn đèn xao động trông hơi mờ và xanh nhạt.,Thuyền trôi từ từ nên ánh đèn cứ thay đổi chỗ mãi.,D,Ngữ văn 8
"Không thể xác định văn bản CÂY DỪA BÌNH ĐỊNH là văn bản tự sự (hay miêu tả, nghị luận, biểu cảm) vì sao?","Văn bản giới thiệu về sự vật, thiên về tính khách quan, không phụ thuộc vào cảm xúc cá nhân.","Văn bản tôn trọng sự thật, không dùng cảm quan cá nhân để thay đổi thông tin về đối tượng","Văn bản cung cấp tri thức về đặc điểm, tính chất, nguyên nhân,… của CÂY DỪA BÌNH ĐỊNH bằng cách trình bày, giới thiệu, giải thích.","Cả A, B, C đều đúng",D,Ngữ văn 8
Ngôn ngữ của văn bản trên có đặc điểm như thế nào?,"Ngôn ngữ của văn bản trên đảm bảo tính khoa học, chính xác, rõ ràng, chặt chẽ",Văn bản dùng nhiều từ ngữ chuyên ngành,Không sử dụng biện pháp tu từ,"Cả A, B, C đều đúng",D,Ngữ văn 8
Dòng nào nêu không đúng về đặc điểm cơ bản của văn thuyết minh?,Cung cấp tri thức khách quan.,"Sử dụng các phương pháp giới thiệu, giải thích,...",Lời văn sử dụng rộng rãi các biện pháp tu từ.,"Ngôn ngữ chính xác, khoa học, dễ hiểu.",A,Ngữ văn 8
Văn bản thuyết minh là gì?,"Là văn bản dùng để trình bày sự việc, diễn biến, nhân vật theo một trật tự nhất định để dẫn đến một kết thú nhằm thuyết phục người đọc, người nghe","Là văn bản trình bày chi tiết, cụ thể cho ta cảm nhận được sự vật, con người một cách sinh động và cụ thể","Là văn bản trình bày những quan điểm, ý kiến thành những luận điểm","Là văn bản dùng phương thức trình bày, giới thiệu, giải thích đặc điểm, tính chất, ... của sự vật, hiện tượng",D,Ngữ văn 8
Nhận định nào nói đúng mục đích của văn bản thuyết minh?,"Đem lại cho con người những tri thức mà con người chưa hề biết đến để hiểu biết và từ đó có thái độ, hành động đúng đắn.","Đem lại cho con người những tri thức chính xác, khách quan về sự vật, hiện tượng để có thái độ, hành động đúng đắn.","Đem lại cho con người những tri thức mới lạ để con người phát hiện ra cái hay, cái đẹp của những tri thức đó.","Đem lại cho con người những tri thức tiêu biểu nhất để con người hiểu biết và bộc lộ suy nghĩ, cảm xúc về chúng.",B,Ngữ văn 8
Văn bản thuyết minh có tính chất gì?,"Chủ quan, giàu tình cảm, cảm xúc.",Mang tính thời sự nóng bỏng.,"Uyên bác, chọn lọc.","Tri thức chuẩn xác, khách quan, hữu ích.",D,Ngữ văn 8
Ngôn ngữ của văn bản thuyết minh có đặc điểm gì?,"Có tính hình tượng, giàu giá trị biểu cảm","Có tính chính xác, cô đọng, chặt chẽ và sinh động",Có tính đa nghĩa và giàu cảm xúc,Có tính cá thể và giàu hình ảnh,B,Ngữ văn 8
Văn bản Thông tin về Ngày Trái Đất năm 2000 thuộc loại văn bản gì?,Văn bản tự sự,Văn bản hành chính,Văn bản thuyết minh,Văn bản biểu cảm,C,Ngữ văn 8
"Khi soạn văn bản thuyết minh, người viết cần phải chú ý một số yêu cầu nào?","Khi bắt đầu viết văn bản thuyết minh về một vấn đề, hiện tượng nào đó trong đời sống, người viết trước hết phải quan sát sự vật, hiện trượng đó để tìm hiểu về tính chất, đặc điểm của chúng;","Cần nắm chắc những đặc điểm và tính chất của sự vật, hiện tượng cần được thuyết minh;","Khi viết bài, người viết cần làm nổi bật các đặc điểm chính của sự vật, hiện tượng cần thuyết minh sao cho việc truyền tải thông tin đến người đọc một cách nhanh chóng và dễ hiểu nhất.",Tất cả các ý trên,D,Ngữ văn 8
Có mấy phương pháp thuyết minh chính?,1,3,5,4,B,Ngữ văn 8
Phần thân bài của bài văn thuyết minh thường làm gì?,Giới thiệu đối tượng thuyết minh,"Trình bày cấu tạo, đặc điểm, lợi ích….của đối tượng",Bày tỏ thái độ đối với đối tượng,Miêu tả chi tiết đối tượng,B,Ngữ văn 8
"Khi thuyết minh về cách làm đền lồng giấy đón Trung thu, các dòng sau nằm ở phần nào?",A. Cách thực hiện,B. Nguyên liệu,C. Yêu cầu thành phẩm,D. Không nằm ở phần nào,B,Ngữ văn 8
Dòng nào nêu khái quát sự khác biệt giữa văn bản thuyết minh và văn bản tự sự,Không có cốt truyện,Không có nhân vật,Không có lời kể,Không hư cấu và không phải văn hình tượng.,D,Ngữ văn 8
Phần kết bài của bài văn thuyết minh thường làm gì?,Giới thiệu đối tượng thuyết minh,"Trình bày cấu tạo, đặc điểm, lợi ích….của đối tượng",Bày tỏ thái độ đối với đối tượng,Miêu tả chi tiết đối tượng,B,Ngữ văn 8
Mục đích chủ yếu của thuyết minh là gì?,"Bình luận về sự vật, hiện tượng.","Nói thật rõ về sự vật, hiện tượng.","Kể về sự vật, hiện tượng.","Ca ngợi sự vật, hiện tượng.",A,Ngữ văn 8
Phần mở bài của bài văn thuyết minh thường làm gì?,Giới thiệu đối tượng thuyết minh,"Trình bày cấu tạo, đặc điểm, lợi ích….của đối tượng",Bày tỏ thái độ đối với đối tượng,Miêu tả chi tiết đối tượng,A,Ngữ văn 8
Bố cục của bài văn thuyết minh gồm mấy phần?,2 phần,3 phần,4 phần,5 phần,B,Ngữ văn 8
"Trong bài, tác giả đã so sánh tác hại của thuốc lá với việc gì?",Với việc tằm ăn dâu,Với việc lan truyền nhanh của các loại ôn dịch,Với việc bị giặc ngoại xâm đánh phá,Với việc sử dụng bao bì ni lông,B,Ngữ văn 8
"Vấn đề mà tác giả muốn làm nổi bật trong câu “Hẳn rằng người hút thuốc lá không lăn đùng ra chết, không say bê bết như người uống rượu” là gì?",Tác hại của thuốc lá đối với sức khỏe con người là không đáng kể,Rượu gây tác hại đối với sức khỏe con người mạnh hơn thuốc lá,Người hút thuốc lá không bị say cũng không bị chết,Tác hại của thuốc lá đối với sức khỏe con người chậm hơn các chất kích thích khác nhưng rất rõ ràng,D,Ngữ văn 8
Câu nào nói lên chủ đề của đoạn văn trên?,Tỉ lệ thanh thiếu niên hút thuốc lá ở các thành phố lớn nước ta ngang với tỉ lệ các thành phố Âu – Mĩ,"Đối với một thiếu niên Việt Nam, muốn có 15 000 đồng mua một bao thuốc lá 555 - vì đã hút là phải hút thuốc sang – chỉ có một cách là trộm cắp","Trộm một lần, quen tay","Từ điếu thuốc sang cốc bia rồi đến ma túy, con đường phạm pháp thực ra đã mở đầu với điếu thuốc .",D,Ngữ văn 8
"Dấu gạch ngang trong câu Chỉ có khác là một thanh niên Mĩ, 1 đô la mua một bao thuốc lá là một khoản tiền nhỏ, còn đối với một thiếu niên Việt Nam, muốn có 15 000 đồng mua một bao 555 – vì đã hút là phải hút thuốc sang – chỉ có một cách là trộm cắp",Để nối các vế câu,Để giải thích,Để liệt kê,Để đánh dấu lời của nhân vật,B,Ngữ văn 8
"Ý nào nói đúng nhất tác dụng của việc dùng dấu phẩy ở nhan đề “Ôn dịch, thuốc lá” của văn bản?",Dùng để ngăn cách hai bộ phận “ôn dịch” và “thuốc lá” trong nhan đề của văn bản,"Dùng theo lối tu từ để nhấn mạnh sắc thái biểu cảm: vừa căm tức, vừa ghê tởm đối với thuốc lá",Dùng bộ phận “thuốc lá” để chú thích cho bộ phận “ôn dịch”,"Cả A, B, C đều sai",A,Ngữ văn 8
"Nhận định nào nói đúng nhất nội dung của văn bản “Ôn dịch, thuốc lá”?",Nói lên tính chất của nạn nghiện thuốc lá: là tệ nạn rất dễ lây lan,Nói lên tính chất của những tác hại mà thuốc lá gây nên: là những tác hại không dễ kịp thời nhận biết,Nói lên tác hại nhiều mặt của thuốc lá đối với cuộc sống gia đình và xã hội,Cả ba nội dung trên,D,Ngữ văn 8
"Theo em, câu văn “nếu giặc đánh như vũ bão thì không đáng sợ, đáng sợ là giặc gặm nhấm như tằm ăn dâu” sử dụng biện pháp nghệ thuật nào?",Nhân hóa,So sánh,Liệt kê,Tương phản,D,Ngữ văn 8
Vấn đề chính mà tác giả muốn đề cập trong đoạn văn sau là gì?,Trộm cắp – cách kiếm tiền để mua thuốc lá của thanh niên Việt Nam,Nguyên nhân dẫn đến nạn trộm cắp ở nước ta là nghiện thuốc lá,Thuốc lá ở Việt Nam đắt hơn ở các nước Âu – Mĩ,So sánh tình hình hút thuốc lá ở nước ta với các nước Âu – Mĩ,B,Ngữ văn 8
Nhận định nào nói lên quan điểm của tác giả về việc hút thuốc lá và tác hại của thuốc lá trên phương diện xã hội?,Là “một tội ác”,Là “quyền của anh”,Là “một cử chỉ cho biểu tượng quý trọng”,Là một loại “ôn dịch”,A,Ngữ văn 8
Đoạn Có người bảo ... nêu gương xấu nói lên tác hại của thuốc lá về phương diện nào?,Kinh tế,Xã hội,Chính trị,Giáo dục,B,Ngữ văn 8
"Nội dung văn bản ""Ôn dịch, thuốc lá "" là:","Nêu lên tác hại nhiều mặt của thuốc lá với cá nhân, cộng đồng.",Kêu gọi mọi người hãy quyết tâm phòng chống nạn hút thuốc lá.,"Chỉ cho mọi người thấy tác hại của ""ôn dịch, thuốc lá"".",Tất cả đều đúng.,A,Ngữ văn 8
"Trọng cụm từ “tằm ăn dâu”, “tằm” được ví với cái gì?",Thuốc lá,Con người,Khói thuốc lá,Bác sĩ,B,Ngữ văn 8
Văn bản Ôn dịch thuốc lá có sự kết hợp chặt chẽ của 2 phương thức tạo lập văn bản nào?,Lập luận và thuyết minh,Thuyết minh và tự sự,Tự sự và biểu cảm,Biểu cảm và thuyết minh,A,Ngữ văn 8
Nguyên nhân nào khiến thanh thiếu niên sử dụng thuốc lá:,Do đua đòi theo bạn bè,Do bị bạn bè rủ rê,Bắt chước người lớn để thể hiện sự “quý trọng”,Tất cả các ý trên,D,Ngữ văn 8
Tác giả so sánh tình hình hút thuốc lá ở nước ta với các nước Âu - Mĩ trước khi đưa ra kiến nghị nhằm mục đích gì?,Tỉ lệ thanh thiếu niên hút thuốc ở thành phố lớn nước ta cao ngang với tỉ lệ các thành phố Âu – Mĩ.,"Các nước đã tiến hành những chiến dịch, thực hiện những biện pháp ngăn ngừa, hạn chế thuốc lá quyết liệt hơn ta.","So sánh với nước họ, chúng ta còn quá nhiều bệnh dịch cần phải thanh toán.",Tất cả đều đúng.,A,Ngữ văn 8
"Trong văn bản Ôn dịch, thuốc lá, khói thuốc lá xâm nhập vào cơ thể con người thông qua con đường nào?",Đường máu.,Qua đường hô hấp.,Đường mẹ truyền sang con.,"Qua tiếp xúc trực tiếp với người bệnh như bắt tay, sử dụng chung dụng cụ vệ sinh hằng ngày.",B,Ngữ văn 8
"Trong văn bản Ôn dịch, thuốc lá, người hút thuốc khác người uống rượu ở điểm nào?",Hút thuốc có thể bị say bê bết.,Hút thuốc có thể lăn đùng ra chết.,Không mất quá nhiều tiền để mua.,"Không lăn đùng ra chết, không say bê bết.",B,Ngữ văn 8
"Trong văn bản Ôn dịch, thuốc lá có đề cập đến lời căn dặn của Trần Hưng Đạo. Trần Hưng Đạo đã căn dặn nhà vua như thế nào?","Nếu giặc đánh như vũ bão thì thật đáng sợ, không đáng sợ là giặc gặm nhấm như tằm ăn dâu.","Nếu giặc đánh như vũ bão thì không đáng sợ, cũng không đáng sợ là giặc gặm nhấm như tằm ăn dâu.","Nếu giặc đánh như vũ bão thì đáng sợ, càng đáng sợ là giặc gặm nhấm như tằm ăn dâu.","Nếu giặc đánh như vũ bão thì không đáng sợ, đáng sợ là giặc gặm nhấm như tằm ăn dâu.",B,Ngữ văn 8
"Trong văn bản Ôn dịch, thuốc lá, bác sĩ viện trưởng Viện Nghiên cứu các bệnh tim mạch kết luận như thế nào về chất ni-cô-tin?","Có tác dụng chữa một số bệnh nguy hiểm như tắc động mạch, nhồi máu cơ tim.","Gây những bệnh nghiêm trọng như huyết áp cao, tắc động mạch nhồi máu cơ tim.",Tác động tốt đến quá trình hấp thụ ô xi của cơ thể.,Không có hại gì nếu như người dùng nó không uống rượu.,A,Ngữ văn 8
"Trong văn bản Ôn dịch, thuốc lá, nhờ tiến bộ của y học, loài người hầu như đã diệt trừ được những đại dịch khủng khiếp nào?","Dịch hạch, cúm gia cầm.","Đậu mùa, dịch hạch.","Dịch hạch, AIDS.","Dịch hạch, thổ tả.",A,Ngữ văn 8
"Ôn dịch, thuốc lá là bài viết của tác giả Nguyễn Khắc Viện trích trong bài nào của ông?","Từ thuốc lá đến ma túy- Bệnh nghiện (NXB Giáo dục, Hà Nội, 1992)","Từ thuốc lá đến ma túy- Bệnh nghiện (NXB Giáo dục, Hà Nội, 1993)","Từ thuốc lá đến ma túy- Bệnh nghiện (NXB Giáo dục, Hà Nội, 1995)","Từ thuốc lá đến ma túy- Bệnh nghiện (NXB Giáo dục, Hà Nội, 1994)",A,Ngữ văn 8
Bố cục của bài gồm mấy phần?,1,2,3,4,C,Ngữ văn 8
Những ôn dịch mới xuất hiện vào đầu thế kỉ là gì:,"dịch hạch, thổ tả",AIDS,thuốc lá,Tất cả các ý trên,D,Ngữ văn 8
"Công dụng của dấu hai chấm trong câu: Xin đáp lại: Hút thuốc là quyền của anh, nhưng anh không có quyền đầu độc những người ở gần anh.",Đánh dấu lời dẫn trực tiếp.,Đánh dấu lời dẫn gián tiếp.,Ngăn cách hai vế câu,Tất cả đều sai,C,Ngữ văn 8
"Để nhấn mạnh tác hại của thuốc lá đến đặc điểm con người, tác giả đã sử dụng biện pháp nghệ thuật gì?","Phương thức thuyết minh , nghị luận , biểu cảm và một số biện pháp nghệ thuật khác.","Phương thức nghị luận, thuyết minh; biện pháp so sánh, liệt kê.",Phương thức thuyết minh; các kiểu câu linh hoạt.,Kết hợp tất cả các phương thức biểu đạt.,A,Ngữ văn 8
Ý nào được tác giả đề cập đến trong bài viết nói đến tác hại của thuốc lá?,"Gây sốt, co giật","Gây ung thu vòm họng và ung thư phổi,gây ngộ độc, gây ngất, khó thở, nôn ra máu",Làm cho thai nhi bị mắc bệnh,"Gây tím tái người, dẫn đến tử vong ngay lập tức",B,Ngữ văn 8
"Quan hệ về nghĩa giữa hai vế trong câu ghép “Trời trong như ngọc, đất sạch như lau” (Vũ Bằng) là quan hệ gì?",Tương phản,Đồng thời,Nối tiếp,Lựa chọn,A,Ngữ văn 8
