Question,A,B,C,D,Answer,Grade
Câu nghi vấn dùng để hỏi thường kết thúc bằng dấu gì?,Dấu chấm hỏi,Dấu chấm,Dấu chấm than,Dấu chấm lửng,A,Ngữ văn 8
Cậu có thể giúp mình giải bài toán này được không?,Cầu khiến,"Bộc lộ tình cảm, cảm xúc",Đe dọa,Khẳng định,B,Ngữ văn 8
Câu nghi vấn trong đoạn thơ dưới đây dùng để làm gì?,Hỏi,"Bộc lộ tình cảm, cảm xúc",Đe dọa,Phủ định,B,Ngữ văn 8
Câu nghi vấn sau dùng để làm gì?,Cầu khiến,"Bộc lộ tình cảm, cảm xúc",Đe dọa,Khẳng định,B,Ngữ văn 8
"Trong các câu nghi vấn sau, câu nào không có mục đích hỏi",Bố đi làm chưa ạ?,Trời ơi! Sao tôi khổ thế này?,Bao giờ bạn được nghỉ tết?,Ai bị điểm kém trong buổi hoc này?,B,Ngữ văn 8
Đoạn văn trên có mấy câu nghi vấn?,A. 2 câu,B. 3 câu,C. 4 câu,D. 5 câu,A,Ngữ văn 8
"Đọc văn bản sau: Thuyết minh về cách làm món ăn: Đậu phụ sốt cà chua Cách thực hiện : Bước 1: Rửa sạch đậu, cà chua, hành lá để ráo nước. Bước 2: Chiên đậu sơ qua. Bước 3: Phi hành tím, hành vàng cho cà chua vào xào nhừ rồi nêm gia vị vừa ăn. Bước 4: Nước sốt sánh thì trút đậu vào, đảo đều, đun trong 5 phút sau đó rắc hành lá cắt khúc lên. Yêu cầu thành phẩm: Đậu vàng, thấm gia vị, có mùi thơm. Hãy cho biết, văn bản trên thiếu nội dung nào ?",Nguyên liệu,Yêu cầu thành phẩm,Cách thực hiện,Không thiếu nội dung nào,A,Ngữ văn 8
Khi giới thiệu một phương pháp (cách làm) người viết cần:,"Tìm hiểu, nắm chắc phương pháp cách làm đó.","Trình bày rõ điều kiện, cách thức, trình tự... làm ra sản phẩm và yêu cầu chất với sản phẩm đó.","Lời văn cần ngắn gọn, rõ ràng.","Kết hợp cả A, B, C.",D,Ngữ văn 8
"Các câu văn sau nằm trong phần nào của bài thuyết minh về cách làm đồ chơi em bé đá bóng: “Các phần thân, đầu và tay chân con người phải có tỉ lệ phù hợp, lại phải ghép các bộ phận sao cho cầu thủ có dáng tâng bóng sinh động thì mới đẹp”",A. Nguyên liệu,B. Yêu cầu thành phẩm,C. Cách làm,D. Không nằm ở phần nào,C,Ngữ văn 8
Hãy cho biết văn bản trên thiếu nội dung nào ?,Yêu cầu thành phẩm,Cách thức,Trình tự,Điều kiện,A,Ngữ văn 8
"Trong bài thuyết minh về một phương pháp (cách làm), lời văn cần:","Ngắn gọn, rõ ràng","Mượt mà, bay bổng","Cụ thể, chi tiết","Cả A, B, C đều đúng",A,Ngữ văn 8
"Hãy cho biết, văn bản trên thiếu nối dung nào ?",Điều kiện,Cách thức,Trình tự,Yêu cầu thành phẩm,A,Ngữ văn 8
Các câu văn sau nằm trong phần nào của bài thuyết minh về cách nấu canh rau ngót với thịt lợn nạc:,A. Nguyên liệu,B. Yêu cầu thành phẩm,C. Cách làm,D. Không nằm ở phần nào,C,Ngữ văn 8
Các câu dưới đây có thể nằm ở phần nào của bài thuyết minh về cách nấu canh rau ngót với thịt lợn nạc?,A. Nguyên liệu,B. Yêu cầu thành phẩm,C. Cách làm,D. Không nằm ở phần nào,B,Ngữ văn 8
Hãy sắp xếp các dòng dưới đây theo thứ tự hợp lí để tạo thành dàn ý phần Thân bài của bài thuyết minh về một phương pháp (một thí nghiệm).,a. Cách thức,b. Yêu cầu chất lượng,c. Điều kiện,d. Trình tự,A,Ngữ văn 8
"Khi giới thiệu một phương pháp (cách làm) nào, người viết cần lưu ý điều gì?","Phải tìm hiểu, nắm chắc phương pháp (cách làm) đó",Phải đánh giá theo hướng khác quan và chủ quan về phương pháp (cách làm) đó,Phải biết những nhận định xoay quanh phương pháp (cách làm) đó,Phải diễn đạt được cả xúc cá nhân khi nói về phương pháp (cách làm) đó,A,Ngữ văn 8
Khi thuyết minh về một phương pháp (cách làm) cần trình bày những vấn đề gì?,"Cần trình bày rõ điều kiện, cách thức, trình tự...làm ra sản phẩm và yêu cầu chất lượng đối với sản phẩm đó.","Cần trình bày rõ nguyên liệu, cách làm, cách bảo quản, cách sử dụng của sản phẩm đó.","Cần trình bày những đánh giá, nhận xét khách quan về sản phẩm đó.","Cần miêu tả cụ thể, từ trong ra ngoài của sản phẩm đó.",A,Ngữ văn 8
Yêu cầu nào đúng với yêu cầu về lời văn của một bài văn thuyết minh về một phương pháp (cách làm)?,"Ngắn gọn, rõ ràng","Câu văn dài, đan xen nhiều hàm ý","Câu cảm thán, câu nghi vấn được dùng chủ yếu",Tất cả các ý trên,A,Ngữ văn 8
Các câu văn sau nằm trong phần nào của bài thuyết minh về “cách nấu canh rau ngót với thịt lợn nạc”:,A. Nguyên liệu,B. Yêu cầu thành phẩm,C. Cách làm,D. Không nằm ở phần nào.,C,Ngữ văn 8
Các câu văn sau nằm trong phần nào của bài thuyết minh về “cách làm đồ chơi em bé đá bóng”:,A. Nguyên liệu,B. Yêu cầu thành phẩm,C. Cách làm,D. Không nằm ở phần nào,C,Ngữ văn 8
Các câu dưới đây có thể nằm ở phần nào của bài thuyết minh về “Cách nấu canh rau ngót với thịt lợn nạc”,A. Nguyên liệu,B. Yêu cầu thành phẩm,C. Cách làm,D. Không nằm ở phần nào,B,Ngữ văn 8
Nếu chưa hoàn chỉnh thì bài văn trên còn thiếu phần nào?,Nguyên liệu,Yêu cầu thành phẩm,Cách làm,Không thiếu phần nào,D,Ngữ văn 8
"Yếu tố nào không bắt buộc phải có trong khi tìm hiểu sự vật, hiện tượng để viết bài văn thuyết minh?","Phải yêu mến, quý trọng đối tượng, sự vật được thuyết minh.","Phải thực lòng muốn truyền đạt cho người khác những hiểu biết về sự vật, hiện tượng.",Phải có phương pháp thuyết minh.,"Hiểu biết rõ ràng, chính xác, đầy đủ về sự vật, hiện tượng cần thuyết minh.",D,Ngữ văn 8
Phương pháp thuyết minh nào sau đây chưa học ở THCS?,"Dùng số liệu, nêu ví dụ","So sánh, phân loại",Giảng giải nguyên nhân – kết quả,"Nêu định nghĩa, liệt kê",D,Ngữ văn 8
Phương pháp thuyết minh bằng cách nêu định nghĩa khác thuyết minh bằng cách chú thích ở điểm gì?,"Làm nổi bật đặc điểm bản chất của sự vật, hiện tượng.","Nắm được chính xác những hiểu biết về sự vật, hiện tượng.","Mang lại những hiểu biết rõ ràng về sự vật, hiện tượng.",Thể hiện được rõ mục đích vủa việc thuyết minh.,A,Ngữ văn 8
"Nguyên tắc của việc vận dụng, phối hợp và lựa chọn các phương pháp thuyết minh là gì?","Làm cho người đọc, người nghe dễ tiếp thu.",Không xa rời mục đích thuyết minh.,"Làm nổi bật bản chất và đặc trưng của sự vật, hiện tượng.","Cả A, B và C.",D,Ngữ văn 8
"Truyện ngắn là tác phẩm tự sự cở nhỏ. Nội dung của thể loại truyện ngắn bao trùm hầu hết các phương diện của đời sống: đời tư, thế sự hay sử thi, nhưng các độc đáo của nó là ngắn. Truyện ngắn được viết ra để thiếp thu liền một mạch, đọc một hơi không nghỉ.",Phân loại,Đưa số liệu,Nêu định nghĩa,Phân tích,C,Ngữ văn 8
Nội dung của bài thơ là,"Hiện thực cảnh sinh hoạt bình dị, nề nếp, gian khổ, thiếu thốn của Bác.",Thể hiện tình yêu thiên nhiên của người chiến sĩ cách mạng.,"Vẻ đẹp tinh thần lạc quan, phong thái ung dung của bác Hồ trong cuộc sống cách mạng gian lao ở Pác Bó.",Tất cả đều đúng,C,Ngữ văn 8
Bài thơ Tức cảnh Pác Bó do ai sáng tác?,Tố Hữu,Chế Lan Viên,Phan Bội Châu,Hồ Chí Minh,D,Ngữ văn 8
"Khi nhận xét về Bác Hồ, nhiều nhà thơ, nhà nghiên cứu đều có chung nhận định: “Trong người Bác luôn có sẵn cái thú lâm tuyền”.",Bác Hồ luôn yêu quý và thường hay nuôi dưỡng những con thú để bầu bạn với mình.,"Bác luôn yêu thích thiên nhiên, sống gần gũi, hòa hợp với hiên nhiên.", Đó là những con vật ở chốn núi rừng.,Sở thích đi săn thú của Bác Hồ.,B,Ngữ văn 8
Câu thơ Sáng ra bờ suối tối vào hang ngắt nhịp như thế nào?,Nhịp 2/2/3,Nhịp 2/2/1/2,Nhịp 4/3,Nhịp 4/1/2,B,Ngữ văn 8
"Hình ảnh người chiến sĩ gánh trên vai nhiệm vụ cao cả, thiêng liêng được thể hiện qua câu thơ nào dưới đây?","Sáng ra bờ suối, tối vào hang",Cháo bẹ rau măng vẫn sẵn sàng,Bàn đá chông chênh dịch sử Đảng,Cuộc đời cách mạng thật là sang,A,Ngữ văn 8
Những hình ảnh nào trong bài thơ đề cập đến những sinh hoạt vật chất hàng ngày của Bác?,"B. Cháo bẹ, rau măng","A. Bờ suối, hang động",C. Bàn đá chông chênh,"D. Cả A, B, C đều đúng",B,Ngữ văn 8
Dòng nào nói đúng nhất giọng điệu chung của bài Tức cảnh Pác Bó?,"Giọng tha thiết, trìu mến.","Giọng vui đùa, dí dỏm.","Giọng nghiêm trang, chừng mực.","Giọng buồn thương, phiền muộn.",A,Ngữ văn 8
Dòng nào diễn tả đúng nhất nghĩa của từ chông chênh?,Không vững chãi vì không có chỗ dựa chắc chắn.,"Ở thế không vững, lắc lư nghiêng ngả như chực ngã.","Cao và không có chỗ bấu víu, luôn đu đưa, nguy hiểm.","Ở trạng thái bất định, khi lên khi xuống, khi nghiêng qua khi ngả lại.",D,Ngữ văn 8
Nhận xét nào nói đúng nhất tâm trạng của Bác Hồ được thể hiện qua câu thơ cuối Cuộc đời cách mạng thật là sang?,Vui thích vì được sống chan hòa với thiên nhiên.,Tin tưởng vào tương lai tươi sáng của đất nước.,Lạc quan với cuộc sống cách mạng đầy gian khổ,Gồm cả ba ý trên.,C,Ngữ văn 8
"Trong bài thơ, cuộc sống vật chất của Bác Hồ như thế nào?","Bác Hồ được sống một cuộc sống vật chất đầy đủ, sang trọng.",Bác Hồ sống bình dị nhưng không hề thiếu thốn.,"Bác Hồ sống với cuộc sống thiếu thốn, gian khổ nhưng Bác vẫn cho rằng đó là một cuộc sống sang trọng.","Bác Hồ sống một cuộc sống tẻ nhạt, buồn chán, không có ý nghĩa.",B,Ngữ văn 8
Tác giả bài thơ là ai?,Tố Hữu,Hồ CHí Minh,Phan Bội Châu,Phan Châu Trinh,A,Ngữ văn 8
Bài thơ được làm theo thể thơ nào?,Thất ngôn tứ tuyệt,Thất ngôn bát cú,Ngũ ngôn,Tự do,A,Ngữ văn 8
Dòng nào diễn tả đúng nhất nghĩa của từ “chông chênh”?,Không vững chãi vì không có chỗ dựa chắc chắn.,"Ở thế không vững, lắc lư nghiêng ngả như chực ngã.","Cao và không có chỗ bấu víu, luôn đu đưa, nguy hiểm.","Ở trạng thái bất định, khi lên khi xuống, khi nghiêng qua khi ngả lại.",D,Ngữ văn 8
Bài thơ nào sau đây không giống thể thơ của bài Tức cảnh Pác Bó?,Bánh trôi nước,Sông núi nước Nam,Khi con tu hú,Ngẫu nhiên viết nhân buổi vể quê,B,Ngữ văn 8
Trung tâm của bức tranh Pác Bó trong bài thơ “Tức cảnh Pác Bó” là,Bàn đá chông chênh.,Hình tượng người chiến sĩ Cách mạng.,Cảnh thiên nhiên với non xanh nước biếc.,Những thức ăn dân dã,B,Ngữ văn 8
Bài thơ “Tức cảnh Pác Bó” được viết theo phương thức biểu đạt nào?,miêu tả và tự sự.,trần thuật và tự sự.,miêu tả và biểu cảm.,tự sự và biểu cảm.,A,Ngữ văn 8
"Khi nhận xét về Bác Hồ, nhiều nhà thơ, nhà nghiên cứu đều có chung nhân định: “Trong người Bác luôn có sẵn cái thú lâm tuyền”, “Thú lâm tuyền” ở đây có nghĩa là:",Bác Hồ luôn yêu quý và thường hay nuôi dưỡng những con thú để bầu bạn với mình.,"Bác luôn yêu thích thiên nhiên, sống gần gũi, hoà hợp vời thiên nhiên.", Đó là những con vật ở chốn núi rừng.,Sở thích đi săn thú của Bác Hồ.,B,Ngữ văn 8
Nhận định nào sau đây phản ánh đúng nhất về tính cách của Bác Hồ trong bài thơ?,"Bình tĩnh, tự tin trong bất kì hoàn cảnh khó khăn nào.","Quyết đoán, kiên định trước mọi tình thế cách mạng.","Yêu nước, thương dân như con.","Ung dung, lạc quan trước cuộc sống cách mạng đẫy khó khăn, gian khổ.",A,Ngữ văn 8
ý nào nói đúng nhất hoàn cảnh sáng tác của bài thơ Tức cảnh Pác Bó ?,Trong thời gian Bác Hồ hoạt động cách mạng ở Cao Bằng chuẩn bị cho Tổng khởi nghĩa.,Trong thời gian Bác Hồ lãnh đạo toàn quốc kháng chiến chống Pháp.,Trong thời gian Bác Hồ lãnh đạo toàn quốc kháng chiến chống Mĩ.,Trong thời gian Bác Hồ bôn ba hoạt động cách mạng ở nước ngoài.,A,Ngữ văn 8
Câu nào nói đúng nhất giọng điệu chung của bài Tức cảnh Pác Bó ?,"Giọng tha thiết, trìu mến.","Giọng vui đùa, dí dỏm.","Giọng nghiêm trang, chừng mực.","Giọng buồn thương, phiền muộn.",A,Ngữ văn 8
Bài thơ nào không được sáng tác theo thể thơ thất ngôn tứ tuyệt ?,Bánh trôi nước – Hồ Xuân Hương,Sông núi nước Nam – Lí Thường Kiệt,Xa ngắm thác núi Lư – Lí Bạch,Qua Đèo Ngang – Bà Huyện Thanh Quan,B,Ngữ văn 8
Dòng nào diễn tả đúng nhất nghĩa của từ “chông chênh” ?,Không vững chãi vì không có chỗ dựa chắc chắn.,"ở thế không vững, lắc lư nghiêng ngả như chực ngã.","Cao và không có chỗ bấu víu, luôn đu đưa, nguy hiểm.","ở trạng thái bất định, khi lên khi xuống, khi nghiêng qua khi ngả lại.",D,Ngữ văn 8
Nhận xét nào nói đúng nhất tâm trạng của Bác Hồ được thể hiện qua câu thơ cuối“Cuộc đời cách mạng thật là sang” ?,Vui thích vì được sống chan hòa với thiên nhiên.,Tin tưởng vào tương lai tươi sáng của đất nước.,Lạc quan với cuộc sống cách mạng đầy gian khổ,Gồm cả ba ý trên.,C,Ngữ văn 8
Câu thơ “Sáng ra bờ suối tối vào hang” ngắt nhịp như thế nào?,Nhịp 2/2/3,Nhịp 2/2/1/2,Nhịp 4/3,Nhịp 4/1/2,B,Ngữ văn 8
"Hình ảnh người chiến sĩ gánh trên vai nhiệm vụ cao cả, thiêng liêng được thể hiện qua câu thơ nào dưới đây?","Sáng ra bờ suối, tối vào hang","Cháo bẹ, rau măng vẫn sẵn sàng",Bàn đá chông chênh dịch sử Đảng,Cuộc đời cách mạng thật là sang,A,Ngữ văn 8
Có bao nhiêu câu cầu khiến trong đoạn văn trên?,2,3,4,5,A,Ngữ văn 8
Câu cầu khiến trong đoạn văn trên có tác dụng gì?,Bày tỏ cảm xúc,Ra lệnh,Đề nghị,Khuyên nhủ,B,Ngữ văn 8
Dòng nào nói đúng nhất dấu hiệu nhận biết của câu cầu khiến?,Sử dụng từ cầu khiến,Sử dụng ngữ điệu cầu khiến,Thường kết thúc câu bằng dấu chấm than,"Gồm cả A, B và C",D,Ngữ văn 8
"Trong những câu nghi vấn sau, câu nào dùng để cầu khiến?",Chị khất tiền sưu đến chiều mai phải không? (Ngô Tất Tố),Người thuê viết nay đâu? (Vũ Đình Liên),"Nhưng lại đằng này đã, về làm gì vội? (Nam Cao)",Chú mình muốn cùng tớ đùa vui không? (Tô Hoài),A,Ngữ văn 8
Câu cầu khiến sau dùng để làm gì?,Yêu cầu,Khuyên bảo,Ra lệnh,Đề nghị,A,Ngữ văn 8
Câu cầu khiến trong những câu dưới đây là:,Thôi đừng lo lắng,Cứ về đi,Mụ già sẽ là nữ hoàng,Cả A và B,D,Ngữ văn 8
Câu cầu khiến sau dùng để làm gì?,Yêu cầu,Đề nghị,Khuyên bảo,Ra lệnh,C,Ngữ văn 8
"Trong những câu sau, câu nào là câu cầu khiến:",Trời ơi! Sao nóng lâu thế?,Hỡi cảnh rừng ghê gớm của ta ơi!,Hãy bỏ rác đúng nơi quy định!,Chao ôi! Một ngày vắng mẹ sao dài đằng đẵng.,C,Ngữ văn 8
Câu cầu khiến là câu như thế nào?,"Là câu có những từ cầu khiến như: hãy, đừng, chớ,...đi, thôi, nào...","Là câu có những từ để hỏi như: phải không, đúng không,...hay ngữ điệu để hỏi","Là câu có những từ biểu đạt cảm xúc như: ôi, chao, trời ơi,...",Tất cả các đáp án trên,D,Ngữ văn 8
"Khi viết, câu cầu khiến thường có đặc điểm gì?","Thường kết thúc bằng dấu chấm than, nhưng khi ý cầu khiến không được nhấn mạnh thì có thể kết thúc bằng dấu chấm câu.","Thường kết thúc bằng dấu chấm hỏi, nhưng khi ý cầu khiến không được nhấn mạnh thì có thể kết thúc bằng dấu chấm câu.","Thường kết thúc bằng dấu phẩy, nhưng khi ý cầu khiến không được nhấn mạnh thì có thể kết thúc bằng dấu chấm câu.","Thường kết thúc bằng dấu ba chấm, nhưng khi ý cầu khiến không được nhấn mạnh thì có thể kết thúc bằng dấu chấm câu.",A,Ngữ văn 8
Các chức năng tiêu biểu của câu cầu khiến là gì?,Dùng để ra lệnh hoặc sai khiến,Dùng để yêu cầu hoặc đề nghị,Dùng để van xin hoặc khuyên bảo,"Cả A, B, C đều đúng",D,Ngữ văn 8
"Câu cầu khiến: "" Đừng hút thuốc nữa nhé! "" dùng để:",Khuyên bảo,Ra lệnh,Yêu cầu,"Cả A, B, C",A,Ngữ văn 8
"Nay chúng ta ….. làm gì nữa, thử xem lão Miệng có sống được không",Nên,Đừng,Không,Hãy,D,Ngữ văn 8
"Hình thức nào để nhận diện câu cầu khiến trong những câu sau: “Đang ngồi viết thư, tôi bỗng nghe tiếng ai đó vọng vào: - Mở cửa!”",Từ cầu khiến,Ngữ điệu cầu khiến,Cả A và B đều đúng,Cả A và B đều sai,C,Ngữ văn 8
Đoạn văn trên có sử dụng câu cầu khiến không?,Có,Không,Không rõ,Không xác định,B,Ngữ văn 8
Có bao nhiêu câu cầu khiến trong đoạn văn trên?,2,3,4,5,B,Ngữ văn 8
Bố cục của bài giới thiệu về một danh lam thắng cảnh gồm những phần nào?,"Mở bài, thân bài, kết bài","Đề, luận, kết","Đặt vấn đề, giải quyết vấn đề, kết luận","Giới thiệu, miêu tả, đánh giá",D,Ngữ văn 8
Bố cục của bài thuyết minh về một danh lam thắng cảnh gồm mấy phần ?,2 phần,3 phần,4 phần,5 phần,B,Ngữ văn 8
Một nhà thơ nước ngoài gọi Hồ Gươm là “chiếc lẵng hoa xinh đẹp giữa lòng Hà Nội”. Em có thể sử dụng câu đó vào phần nào trong bài viết của mình?,Phần mở bài,Phần kết bài,Phần đầu tiên của đoạn văn giới thiệu Hồ Gươm,Cả A và C đều đúng,D,Ngữ văn 8
Dòng nào nói đúng nhất nội dung chủ yếu của văn bản trên ?,Giới thiệu tháp cổ Chăm-pa ở phương diện kiến trúc.,Giới thiệu tháp cổ Chăm-pa ở phương diện kinh tế.,Giới thiệu tháp cổ Chăm-pa ở phương diện lịch sử.,Giới thiệu tháp cổ Chăm-pa ở phương diện văn hoá.,C,Ngữ văn 8
Bố cục của văn bản trên gồm mấy phần ?,Hai phần,Ba phần,Không rõ ràng,"Cả A, B, C đều sai",B,Ngữ văn 8
Dòng nào nói đúng nhất góc độ quan sát tháp cổ của người viết ?,Đứng ở bên ngoài nhìn vào.,Đứng ở bên trong nhìn ra.,Đứng ở trên đỉnh tháp nhìn xuống.,Đứng từ rất xa nhìn lại.,A,Ngữ văn 8
"Để viết được văn bản này, người viết cần có những kiến thức về tháp cổ Chăm-pa ở những phương diện nào ?",Phương diện lịch sử,Phương diện kiến trúc,Phương diện xã hội,"Gồm cả A, B, và C",D,Ngữ văn 8
"Trong các đề bài sau, đề nào dùng để thuyết minh về một danh lam thắng cảnh?",Thuyết Minh về Hồ Hoàn Kiếm và Đền Ngọc Sơn ở Hà Nội,Thuyết minh về chiếc bút máy,Giới thiệu về món ăn truyền thống của dân tộc,Thuyết minh về cách làm một chiếc diều giấy,A,Ngữ văn 8
Lời giới thiệu của bài giới thiệu về một danh lam thắng cảnh cần lưu ý những điều gì?,"Ít nhiều có kèm theo miêu tả, bình luận thì sẽ hấp dẫn hơn.",Ít nhiều có kèm theo đánh giá của những người đã trải nghiệm thì sẽ tốt hơn.,Ít nhiều có kèm theo hình ảnh thì sẽ hấp dẫn hơn.,Cả 3 đáp án trên.,D,Ngữ văn 8
Xác định nội dung phần thân bài?,Từ đâu đến 'Vịnh Hạ Long ở Quảng Ninh.',Từ đầu đến 'công nhận là di sản văn hoá thế giới.',Từ 'Vịnh Hạ Long là một tuyệt tác...' đến 'cọ rửa các hòn đảo.',Từ 'Vịnh Hạ Long là một tuyệt tác...' đến hết bài.,C,Ngữ văn 8
Muốn có kiến thức để giới thiệu một danh lam thắng cảnh chúng ta phải làm gì?,Trực tiếp tham quan danh lam thắng cảnh đó,"Tra cứu tài liệu, sách vở về danh lam thắng cảnh đó",Học hỏi những người có hiểu biết về danh lam thắng cảnh đó,"Cả A,B,C.",D,Ngữ văn 8
Lời văn trong bài thuyết minh về danh lam thắng cảnh cần:,Bay bổng nhẹ nhàng,Đa nghĩa,Biểu cảm,Chính xác và biểu cảm,D,Ngữ văn 8
"Trong các đề bài sau, đề nào dùng để thuyết minh về một danh lam thắng cảnh?",Thuyết Minh về Vịnh Hạ Long,Thuyết minh về trang phục truyền thống,Giới thiệu về món ăn truyền thống của dân tộc,Thuyết minh về nghề thủ công truyền thống,A,Ngữ văn 8
Bài văn trên thuyết minh về danh lam thắng cảnh nào?,Vịnh Hạ Long,Chùa Một Cột,Chùa Hương,Hồ Hoàn Kiếm,A,Ngữ văn 8
"Văn bản trên trình bày, giới thiệu, giải thích điều gì?",Thuyết minh về cuộc khởi nghĩa của dân tộc Tày.,Thuyết minh về tù trưởng dân tộc Tày Nông Văn Vân và cuộc khởi nghĩa do ông lãnh đạo.,Thuyết minh về vùng núi Tây Bắc.,Thuyết minh về làng của người Mường.,B,Ngữ văn 8
"Hai đoạn văn ở câu 7, 8 có gì giống với đoạn văn ở câu 9?",A. Hai văn bản đều có tính chất khách quan,"B. Đều có mục đích là truyền đạt thông tin khoa học về lịch sử, sinh vật","C. Đều có tính chất trình bày, giới thiệu, giải thích.",D. Cả 3 đáp án trên,D,Ngữ văn 8
Cho đề bài sau: Giới thiệu một gương mặt trẻ của thể thao Việt Nam. Đối tượng thuyết minh của đề bài trên là gì?,Một gương mặt trẻ của thể thao.,Một vị huấn luyện viên của thể thao.,Một vị trọng tài của thể thao.,Một vị giám đốc của một câu lạc bộ thể thao.,A,Ngữ văn 8
Nội dung sau đây nào phù hợp với đề bài: Giới thiệu một gương mặt trẻ của thể thao Việt Nam.,Thâm niêm công tác của người đó trong ngành thể thao.,"Vị trí của người đó trong đội, trong nền thể thao nước nhà.","Bằng cấp, chứng chỉ của người để để tham gia hành nghề trong lĩnh vực thể thao.",Vị trí của người đó trong bảng xếp hàng tổng tài sản có được.,B,Ngữ văn 8
Đối tượng thuyết minh của đề bài Thuyết minh về một món ăn dân tộc là gì?,Món bít tết bò kiểu Mỹ,Một món ăn dân tộc,Một thức quà ăn vặt,Một loại thực phẩm phổ biến trong cuộc sống hàng ngày,B,Ngữ văn 8
"Nội dung nào không phù hợp với đề bài Thuyết minh về một món ăn dân tộc (bánh chưng, bánh giầy, phở, cốm....)?",Phủ định sự tồn tại của món ăn trong đời sống.,Những nguyên liệu tạo nên món ăn và cách làm món ăn,"Ý nghĩa, các dịp thường thưởng thức của món ăn.",Giới thiệu tên món ăn,D,Ngữ văn 8
"Làm sao để người viết có được những tri thức đúng, phong phú và hữu ích về đối tượng được thuyết minh?","Hỏi han, nói chuyện với nhiều người","Dành nhiều thời gian quan sát, tìm hiểu về sự vật, hiện tượng","Năm được những yếu tố bản chất, đặc trưng nhất của đối tượng thuyết minh",Câu B và C đúng,D,Ngữ văn 8
